{
  "$schema": "https://json-schema.org/draft/2020-12/schema",
  "$id": "https://endroit.org/schema/work/v1alpha1.json",
  "title": "Endroit Work Item v1alpha1",
  "type": "object",
  "additionalProperties": false,
  "required": [
    "$schema",
    "version",
    "objective",
    "workType",
    "expectedEffect",
    "sources",
    "claims",
    "obligations",
    "contradictions",
    "assignments",
    "verification",
    "observedResult",
    "review"
  ],
  "properties": {
    "$schema": {
      "const": "https://endroit.org/schema/work/v1alpha1.json"
    },
    "version": {
      "const": "endroit/work/v1alpha1"
    },
    "objective": {
      "type": "string"
    },
    "workType": {
      "type": [
        "string",
        "null"
      ],
      "pattern": "^[a-z0-9][a-z0-9._-]*/[a-z0-9][a-z0-9._-]*$"
    },
    "expectedEffect": {
      "type": [
        "string",
        "null"
      ]
    },
    "sources": {
      "type": "array",
      "items": {
        "$ref": "#/$defs/source"
      }
    },
    "claims": {
      "type": "array",
      "items": {
        "$ref": "#/$defs/claim"
      }
    },
    "obligations": {
      "type": "array",
      "items": {
        "$ref": "#/$defs/obligation"
      }
    },
    "contradictions": {
      "type": "array",
      "items": {
        "$ref": "#/$defs/contradiction"
      }
    },
    "assignments": {
      "type": "array",
      "items": {
        "$ref": "#/$defs/assignment"
      }
    },
    "verification": {
      "type": "array",
      "items": {
        "$ref": "#/$defs/verification"
      }
    },
    "observedResult": {
      "anyOf": [
        {
          "type": "null"
        },
        {
          "$ref": "#/$defs/observedResult"
        }
      ]
    },
    "review": {
      "type": "array",
      "items": {
        "$ref": "#/$defs/review"
      }
    }
  },
  "$defs": {
    "id": {
      "type": "string",
      "pattern": "^[a-z0-9][a-z0-9._-]{0,127}$"
    },
    "ref": {
      "type": "string",
      "minLength": 1,
      "maxLength": 2048
    },
    "evidence": {
      "type": "array",
      "items": {
        "$ref": "#/$defs/ref"
      }
    },
    "source": {
      "type": "object",
      "additionalProperties": false,
      "required": [
        "ref",
        "role"
      ],
      "properties": {
        "ref": {
          "$ref": "#/$defs/ref"
        },
        "role": {
          "enum": [
            "authority",
            "context",
            "constraint",
            "evidence"
          ]
        }
      }
    },
    "claim": {
      "type": "object",
      "additionalProperties": false,
      "required": [
        "id",
        "statement",
        "status",
        "evidence"
      ],
      "properties": {
        "id": {
          "$ref": "#/$defs/id"
        },
        "statement": {
          "type": "string",
          "minLength": 1
        },
        "status": {
          "enum": [
            "current",
            "verified",
            "qualified",
            "proposed",
            "research",
            "historical",
            "superseded"
          ]
        },
        "evidence": {
          "$ref": "#/$defs/evidence"
        }
      }
    },
    "obligation": {
      "type": "object",
      "additionalProperties": false,
      "required": [
        "id",
        "description",
        "required",
        "status",
        "evidence"
      ],
      "properties": {
        "id": {
          "$ref": "#/$defs/id"
        },
        "description": {
          "type": "string",
          "minLength": 1
        },
        "required": {
          "type": "boolean"
        },
        "status": {
          "enum": [
            "open",
            "satisfied",
            "contradicted"
          ]
        },
        "evidence": {
          "$ref": "#/$defs/evidence"
        }
      }
    },
    "contradiction": {
      "type": "object",
      "additionalProperties": false,
      "required": [
        "id",
        "description",
        "sources",
        "status",
        "resolution",
        "evidence"
      ],
      "properties": {
        "id": {
          "$ref": "#/$defs/id"
        },
        "description": {
          "type": "string",
          "minLength": 1
        },
        "sources": {
          "type": "array",
          "items": {
            "$ref": "#/$defs/ref"
          }
        },
        "status": {
          "enum": [
            "open",
            "resolved"
          ]
        },
        "resolution": {
          "type": [
            "string",
            "null"
          ]
        },
        "evidence": {
          "$ref": "#/$defs/evidence"
        }
      }
    },
    "destination": {
      "type": "object",
      "additionalProperties": false,
      "required": [
        "owner",
        "site",
        "route"
      ],
      "properties": {
        "owner": {
          "type": [
            "string",
            "null"
          ]
        },
        "site": {
          "type": [
            "string",
            "null"
          ],
          "pattern": "^[a-z0-9][a-z0-9._-]{0,127}$"
        },
        "route": {
          "type": [
            "string",
            "null"
          ],
          "pattern": "^[a-z0-9][a-z0-9._-]{0,127}$"
        }
      }
    },
    "assignment": {
      "type": "object",
      "additionalProperties": false,
      "required": [
        "id",
        "objective",
        "role",
        "sources",
        "destination",
        "expectedEffect",
        "verification",
        "status"
      ],
      "properties": {
        "id": {
          "$ref": "#/$defs/id"
        },
        "objective": {
          "type": "string",
          "minLength": 1
        },
        "role": {
          "type": "string",
          "minLength": 1
        },
        "sources": {
          "type": "array",
          "items": {
            "$ref": "#/$defs/ref"
          }
        },
        "destination": {
          "$ref": "#/$defs/destination"
        },
        "expectedEffect": {
          "type": [
            "string",
            "null"
          ]
        },
        "verification": {
          "type": "array",
          "items": {
            "$ref": "#/$defs/id"
          }
        },
        "status": {
          "enum": [
            "planned",
            "active",
            "returned",
            "blocked"
          ]
        }
      }
    },
    "verification": {
      "type": "object",
      "additionalProperties": false,
      "required": [
        "id",
        "description",
        "status",
        "evidence"
      ],
      "properties": {
        "id": {
          "$ref": "#/$defs/id"
        },
        "description": {
          "type": "string",
          "minLength": 1
        },
        "status": {
          "enum": [
            "not-run",
            "passed",
            "failed"
          ]
        },
        "evidence": {
          "$ref": "#/$defs/evidence"
        }
      }
    },
    "observedResult": {
      "type": "object",
      "additionalProperties": false,
      "required": [
        "status",
        "summary",
        "evidence"
      ],
      "properties": {
        "status": {
          "enum": [
            "complete",
            "partial",
            "failed"
          ]
        },
        "summary": {
          "type": "string",
          "minLength": 1
        },
        "evidence": {
          "$ref": "#/$defs/evidence"
        }
      }
    },
    "review": {
      "type": "object",
      "additionalProperties": false,
      "required": [
        "id",
        "label",
        "kind",
        "target",
        "question",
        "owner",
        "status",
        "note"
      ],
      "properties": {
        "id": {
          "$ref": "#/$defs/id"
        },
        "label": {
          "type": "string",
          "minLength": 1
        },
        "kind": {
          "enum": [
            "url",
            "file"
          ]
        },
        "target": {
          "type": "string",
          "minLength": 1
        },
        "question": {
          "type": "string",
          "minLength": 1
        },
        "owner": {
          "type": "string",
          "minLength": 1
        },
        "status": {
          "enum": [
            "pending",
            "accepted",
            "changes-requested",
            "blocked"
          ]
        },
        "note": {
          "type": [
            "string",
            "null"
          ]
        }
      }
    }
  }
}
