{
  "$schema": "https://endroit.org/schema/work/v1alpha1.json",
  "version": "endroit/work/v1alpha1",
  "objective": "",
  "workType": null,
  "expectedEffect": null,
  "sources": [],
  "claims": [],
  "obligations": [],
  "contradictions": [],
  "assignments": [],
  "verification": [],
  "observedResult": null,
  "review": []
}
